{"generated":"2026-06-18T15:25:48","controls":{"booking_start":"5/2/26","booking_end":"5/29/26","snapshot":"6/17/26","demand_basis":"Formulary Primary"},"activation":{"Atlanta":"Y","Central":"Y","Cleveland":"N","Dallas":"Y","Dayton":"N","Ft Wayne":"N","Greenwood":"Y","Houston":"Y","Kansas":"Y","Lincolnwood":"Y","Minnesota":"N","Naperville":"Y","New Braunfels":"Y","Pittsburgh":"Y","Scranton":"Y","St Louis":"Y","Swansea":"Y","Tinley Park":"Y","Washington":"Y"},"rows":[["Atlanta","Medline","Roll Kit","Box/Case",50.0,145.0,6.0,0.0,0.0,0.0,0.0,0.0,"OK"],["Atlanta","Medline","Peripheral IV Catheter, 24G x 3/4\"","Box/Case",50.0,96.0,15.0,0.0,0.0,0.0,0.0,0.0,"OK"],["Atlanta","Medline","Peripheral IV Catheter, 22G x 1\"","Box/Case",50.0,96.0,11.0,0.0,0.0,0.0,0.0,0.0,"OK"],["Atlanta","Medline","Syringe/Needle Combo, 3 mL, 25G x 1\"","Box/Case",100.0,19.85,5.0,5.71,3.8,1.0,100.0,19.85,"Below Target"],["Atlanta","Medline","Hypodermic Needle, 18G x 1\"","Box/Case",100.0,3.42,9.0,11.41,7.61,3.0,300.0,10.26,"Below Target"],["Atlanta","Medline","Syringe, 1 mL Luer-Lok, without needle","Box/Case",100.0,14.75,5.0,5.71,3.8,1.0,100.0,14.75,"Below Target"],["Atlanta","Medline","Syringe, 3 mL Luer-Lok, without needle","Box/Case",100.0,19.85,0.0,4.56,3.04,5.0,500.0,99.25,"ORDER"],["Atlanta","Medline","Syringe, 10 mL Luer-Lok, without needle","Box/Case",100.0,10.07,16.0,3.8,2.54,0.0,0.0,0.0,"OK"],["Atlanta","Medline","Syringe, 20 mL Luer-Lok, without needle","Box/Case",40.0,16.23,6.0,7.61,5.07,2.0,80.0,32.46,"Below Target"],["Atlanta","Medline","Syringe, 30 mL Luer-Lok, without needle","Box/Case",40.0,21.51,5.6,6.52,4.35,1.0,40.0,21.51,"Below Target"],["Atlanta","Medline","Syringe, 50 mL Luer-Lok, without needle","Box/Case",40.0,19.92,14.0,5.71,3.8,0.0,0.0,0.0,"OK"],["Atlanta","Medline","Syringe, 60 mL Luer-Lok, without needle","Box/Case",40.0,14.51,4.0,4.56,3.04,1.0,40.0,14.51,"Below Target"],["Atlanta","Medline","Prefilled Flush Syringe, 0.9% Sodium Chloride, 10 mL","Box/Case",100.0,53.19,4.0,3.8,2.54,0.0,0.0,0.0,"OK"],["Atlanta","TwinMed","Exam Gloves, Nitrile, Small","Box/Case",2000.0,55.0,3.0,0.0,0.0,0.0,0.0,0.0,"OK"],["Atlanta","TwinMed","Exam Gloves, Nitrile, Medium","Box/Case",2000.0,55.0,1.0,0.0,0.0,0.0,0.0,0.0,"OK"],["Atlanta","TwinMed","Exam Gloves, Nitrile, Large","Box/Case",2000.0,55.0,3.0,0.0,0.0,0.0,0.0,0.0,"OK"],["Atlanta","TwinMed","Exam Gloves, Nitrile, X-Large","Box/Case",2000.0,55.0,0.0,0.0,0.0,0.0,0.0,0.0,"No Demand"],["Atlanta","Medline","Adhesive Bandage, 1\" x 3\"","Box/Case",100.0,1.83,5.0,0.0,0.0,0.0,0.0,0.0,"OK"],["Atlanta","Medline","Underpad / Chux, 17\" x 24\"","Box/Case",300.0,17.36,2.0,0.0,0.0,0.0,0.0,0.0,"OK"],["Atlanta","Medline","Nonwoven Gauze Sponge, 2\" x 2\", nonsterile","Box/Case",5000.0,17.75,2.0,0.0,0.0,0.0,0.0,0.0,"OK"],["Atlanta","Medline","Coban / Cohesive Bandage, 2\" x 5 yd","Box/Case",36.0,25.26,6.0,0.0,0.0,0.0,0.0,0.0,"OK"],["Atlanta","Medline","Alcohol Prep Pads, 70% IPA, Large","Box/Case",1000.0,16.11,2.0,0.0,0.0,0.0,0.0,0.0,"OK"],["Atlanta","Medline","Paper Tape, 1\" x 10 yd","Box/Case",12.0,8.1,5.0,0.0,0.0,0.0,0.0,0.0,"OK"],["Atlanta","Medline","Tegaderm / Transparent Dressing, 2.4\" x 2.8\"","Box/Case",1.0,29.47,4.0,2.0,2.0,0.0,0.0,0.0,"OK"],["Atlanta","Medline","IV Bag Cover, Light Amber, 8\" x 14\"","Box/Case",100.0,26.58,2.0,0.0,0.0,0.0,0.0,0.0,"OK"],["Atlanta","Medline","Sharps Container, 5 qt","Box/Case",1.0,4.3,0.0,0.0,0.0,0.0,0.0,0.0,"No Demand"],["Atlanta","Medline","Sharps Container, 1 qt / 0.25 gal","Box/Case",1.0,1.62,16.0,0.0,0.0,0.0,0.0,0.0,"OK"],["Atlanta","Medline","IV Start Kit, 6-piece with alcohol prep pad","Box/Case",100.0,73.13,0.0,1.52,1.02,2.0,200.0,146.26,"ORDER"],["Atlanta","Medline","IV Administration Set, Flow Regulator, 15 drops/mL","Box/Case",50.0,116.61,2.0,0.0,0.0,0.0,0.0,0.0,"OK"],["Atlanta","Medline","Germicidal Wipes, Super Sani-Cloth canister","Box/Case",1.0,5.65,6.0,0.0,0.0,0.0,0.0,0.0,"OK"],["Atlanta","Medline","Hand Sanitizer Pump","Box/Case",1.0,3.25,14.0,2.0,2.0,0.0,0.0,0.0,"OK"],["Atlanta","Medline","Instant Hot Pack / Hand Warmer, 4\" x 9\"","Box/Case",24.0,19.09,1.0,0.76,0.51,0.0,0.0,0.0,"OK"],["Atlanta","Medline","Procedure Face Masks","Box/Case",50.0,5.53,0.0,2.0,2.0,2.0,100.0,11.06,"ORDER"],["Atlanta","Medline","Vial Spike / IV Dispensing Pin Mini-Spike","Box/Case",50.0,64.43,0.0,0.0,0.0,0.0,0.0,0.0,"No Demand"],["Atlanta","Infusive","Olympia Amino Blend","Static/Excluded",1.0,53.0,0.0,0.0,0.0,0.0,0.0,0.0,"No Demand"],["Atlanta","Infusive","Olympia Ascorbic Acid","Vial",1.0,23.0,172.0,353.63,235.76,182.0,182.0,4186.0,"ORDER"],["Atlanta","Infusive","Olympia Vita Complex (B-Complex)","Vial",1.0,48.0,54.0,55.0,47.15,2.0,2.0,96.0,"Below Target"],["Atlanta","Infusive","Biotin (pooled 10+30 mL)","Vial",1.0,36.0,25.0,38.29,25.52,14.0,14.0,504.0,"ORDER"],["Atlanta","Infusive","Biotin 30 mL (stock view)","Display",1.0,45.0,5.0,0.0,0.0,0.0,0.0,0.0,"Stock View"],["Atlanta","Infusive","Folic Acid","Vial",1.0,38.0,10.0,44.53,29.69,35.0,35.0,1330.0,"ORDER"],["Atlanta","Infusive","Olympia Glutathione","Vial",1.0,35.0,11.0,20.68,20.68,10.0,10.0,350.0,"ORDER"],["Atlanta","Infusive","Empower Glycine","Static/Excluded",1.0,30.0,10.0,0.0,0.0,0.0,0.0,0.0,"OK"],["Atlanta","Infusive","Olympia Methylcobalamin","Vial",1.0,43.7,7.0,14.09,9.39,8.0,8.0,349.6,"ORDER"],["Atlanta","Infusive","McKesson Magnesium Chloride (MgCl) - 50 mL","Vial",1.0,26.0,28.0,63.63,42.42,36.0,36.0,936.0,"ORDER"],["Atlanta","Infusive","Olympia Taurine","Vial",1.0,30.0,18.0,25.64,17.09,8.0,8.0,240.0,"Below Target"],["Atlanta","Infusive","Olympia Vitamin D","Vial",1.0,45.0,13.0,5.08,3.39,0.0,0.0,0.0,"OK"],["Atlanta","Infusive","Zinc Sulfate 10 mL (Preferred)","Vial",1.0,29.75,74.0,106.05,70.7,33.0,33.0,981.75,"Below Target"],["Atlanta","Infusive","Olympia Calcium Chloride","Vial",1.0,33.0,8.0,35.33,23.55,28.0,28.0,924.0,"ORDER"],["Atlanta","Medline","250 ml NS-SKU # BHL2B1322Q","Bag",36.0,66.65,106.0,167.14,111.43,2.0,72.0,133.3,"ORDER"],["Atlanta","Medline","500 ml NS-SKU # BHL2B1323QCS","Bag",24.0,46.92,146.0,710.36,473.57,24.0,576.0,1126.08,"ORDER"],["Atlanta","Medline","1000 ml NS-SKU # BHL2B1324X","Bag",14.0,29.3,0.0,257.14,171.43,19.0,266.0,556.7,"ORDER"],["Central","Medline","Roll Kit","Box/Case",50.0,145.0,13.0,0.0,0.0,0.0,0.0,0.0,"OK"],["Central","Medline","Peripheral IV Catheter, 24G x 3/4\"","Box/Case",50.0,96.0,16.0,0.0,0.0,0.0,0.0,0.0,"OK"],["Central","Medline","Peripheral IV Catheter, 22G x 1\"","Box/Case",50.0,96.0,2.0,0.0,0.0,0.0,0.0,0.0,"OK"],["Central","Medline","Syringe/Needle Combo, 3 mL, 25G x 1\"","Box/Case",100.0,19.85,5.0,4.96,3.31,0.0,0.0,0.0,"OK"],["Central","Medline","Hypodermic Needle, 18G x 1\"","Box/Case",100.0,3.42,9.0,9.92,6.61,1.0,100.0,3.42,"Below Target"],["Central","Medline","Syringe, 1 mL Luer-Lok, without needle","Box/Case",100.0,14.75,6.0,4.96,3.31,0.0,0.0,0.0,"OK"],["Central","Medline","Syringe, 3 mL Luer-Lok, without needle","Box/Case",100.0,6.18,2.0,3.97,2.64,2.0,200.0,12.36,"ORDER"],["Central","Medline","Syringe, 10 mL Luer-Lok, without needle","Box/Case",100.0,10.07,6.0,3.31,2.2,0.0,0.0,0.0,"OK"],["Central","Medline","Syringe, 20 mL Luer-Lok, without needle","Box/Case",40.0,16.23,6.0,6.61,4.41,1.0,40.0,16.23,"Below Target"],["Central","Medline","Syringe, 30 mL Luer-Lok, without needle","Box/Case",40.0,21.51,5.6,5.67,3.78,1.0,40.0,21.51,"Below Target"],["Central","Medline","Syringe, 50 mL Luer-Lok, without needle","Box/Case",40.0,19.92,4.0,4.96,3.31,1.0,40.0,19.92,"Below Target"],["Central","Medline","Syringe, 60 mL Luer-Lok, without needle","Box/Case",40.0,14.51,3.0,3.97,2.64,1.0,40.0,14.51,"Below Target"],["Central","Medline","Prefilled Flush Syringe, 0.9% Sodium Chloride, 10 mL","Box/Case",100.0,53.19,3.0,3.31,2.2,1.0,100.0,53.19,"Below Target"],["Central","TwinMed","Exam Gloves, Nitrile, Small","Box/Case",2000.0,55.0,12.0,0.0,0.0,0.0,0.0,0.0,"OK"],["Central","TwinMed","Exam Gloves, Nitrile, Medium","Box/Case",2000.0,55.0,17.0,0.0,0.0,0.0,0.0,0.0,"OK"],["Central","TwinMed","Exam Gloves, Nitrile, Large","Box/Case",2000.0,55.0,17.0,0.0,0.0,0.0,0.0,0.0,"OK"],["Central","TwinMed","Exam Gloves, Nitrile, X-Large","Box/Case",2000.0,55.0,0.0,0.0,0.0,0.0,0.0,0.0,"No Demand"],["Central","Medline","Adhesive Bandage, 1\" x 3\"","Box/Case",100.0,1.83,7.0,0.0,0.0,0.0,0.0,0.0,"OK"],["Central","Medline","Underpad / Chux, 17\" x 24\"","Box/Case",300.0,25.4,2.0,0.0,0.0,0.0,0.0,0.0,"OK"],["Central","Medline","Nonwoven Gauze Sponge, 2\" x 2\", nonsterile","Box/Case",5000.0,17.75,1.0,0.0,0.0,0.0,0.0,0.0,"OK"],["Central","Medline","Coban / Cohesive Bandage, 2\" x 5 yd","Box/Case",36.0,25.26,4.0,0.0,0.0,0.0,0.0,0.0,"OK"],["Central","Medline","Alcohol Prep Pads, 70% IPA, Large","Box/Case",1000.0,16.11,19.0,0.0,0.0,0.0,0.0,0.0,"OK"],["Central","Medline","Paper Tape, 1\" x 10 yd","Box/Case",12.0,8.1,2.0,0.0,0.0,0.0,0.0,0.0,"OK"],["Central","Medline","Tegaderm / Transparent Dressing, 2.4\" x 2.8\"","Box/Case",1.0,29.47,3.0,2.0,2.0,0.0,0.0,0.0,"OK"],["Central","Medline","IV Bag Cover, Light Amber, 8\" x 14\"","Box/Case",100.0,26.58,0.0,0.0,0.0,0.0,0.0,0.0,"No Demand"],["Central","Medline","Sharps Container, 5 qt","Box/Case",1.0,4.3,5.0,0.0,0.0,0.0,0.0,0.0,"OK"],["Central","Medline","Sharps Container, 1 qt / 0.25 gal","Box/Case",1.0,1.62,16.0,0.0,0.0,0.0,0.0,0.0,"OK"],["Central","Medline","IV Start Kit, 6-piece with alcohol prep pad","Box/Case",100.0,73.13,0.0,1.32,0.88,2.0,200.0,146.26,"ORDER"],["Central","Medline","IV Administration Set, Flow Regulator, 15 drops/mL","Box/Case",50.0,116.61,3.0,0.0,0.0,0.0,0.0,0.0,"OK"],["Central","Medline","Germicidal Wipes, Super Sani-Cloth canister","Box/Case",1.0,5.65,4.0,0.0,0.0,0.0,0.0,0.0,"OK"],["Central","Medline","Hand Sanitizer Pump","Box/Case",1.0,3.25,6.0,2.0,2.0,0.0,0.0,0.0,"OK"],["Central","Medline","Instant Hot Pack / Hand Warmer, 4\" x 9\"","Box/Case",24.0,19.09,3.0,0.66,0.44,0.0,0.0,0.0,"OK"],["Central","Medline","Procedure Face Masks","Box/Case",50.0,5.53,3.0,2.0,2.0,0.0,0.0,0.0,"OK"],["Central","Medline","Vial Spike /